id,type,text1,text2,text3,notes,Column 07
SGB_Fleamut,SHIP,"The Flemut class is a more strike-oriented modification of the Sunder, with extreme modifcation without regard to cost. Although most of the ship's internal structure have been taken up to install its unique mobility system and some weapon slots are lost, these changes does not change the ship's excellent burst damage capabilities. Several Flemut can isolate and shread and enemy like a pack of hyenas before leaving them a mangled wreck following an explosion.

Though the Flemut designw as finalized long ago, few anticipated the ship to turn out the way it did. The Sunder was only selected as the ship's basis as a chat within the design bureau, and the ship system is just a beneifical system error arising out of the Hammies system upgrade. In the end, the Shackle's engineers did everything they could to reproduce and stabilize that system error, resulting in this terrifying design. ",,,,
SGB_Fleamut_2,SHIP,"This Fleumut is an extremely rare original prototype, adjusted only to the extent required to use modern weapons. Compared to most modern Flemut, this one still follows its original armor plan - Using sturdier and valuable armor modules that does not compromise mobility and flux dissipation at all. Given the sudden burst movement provided by the ship's system, it can serve as the spear of the fleet - positioned amongst the fleet and going for the target's throat the moment an opening presents itself. 

The Flemut class is a more strike-oriented modification of the Sunder, with extreme modifcation without regard to cost. Although most of the ship's internal structure have been taken up to install its unique mobility system and some weapon slots are lost, these changes does not change the ship's excellent burst damage capabilities. Several Flemut can isolate and shread and enemy like a pack of hyenas before leaving them a mangled wreck following an explosion.

Though the Flemut designw as finalized long ago, few anticipated the ship to turn out the way it did. The Sunder was only selected as the ship's basis as a chat within the design bureau, and the ship system is just a beneifical system error arising out of the Hammies system upgrade. In the end, the Shackle's engineers did everything they could to reproduce and stabilize that system error, resulting in this terrifying design. 。",,,,
SGB_Cindotch,SHIP,"Cindotch is basically a word made up by the word Cinder North, meaning an opening where cinders are expelled. While the name is far from flattering, the Cindotch can steadily apply pressure on enemy ships while providing escort.

Often known as ""pretty good assualt meat ball"" amongst veteran mercs.

Definately not a space tank with afterburners.",,,,
SGB_HexagonalScreen,SHIP,"The Hexegonal Screen is an obselete auxilary ship that has been removed from the Shackles fleet, replaced by the cheaper Anoyas freighter - Thats the official statement anyway, but these demilitarized metal boxes still remain active as civilian ships.

The Hexegonal Screen has a stable ship system, apprently as a result of a system loop hole that cause the ship system to react extremely to various problems. After various adjustment, this allows the Hexegonal Screen to keep its resource consumption at a minimal in combat, letting it operate for longer. Even though its armament makes extended combat operation a very undesirable proposition for most. 
",,,,
SGB_HexagonalScreen_C,SHIP,"This Hexgonal Screen is modified to dig out a flight deck without compromising stortage. The Hexegonal Screen is an obselete auxilary ship that has been removed from the Shackles fleet, replaced by the cheaper Anoyas freighter - Thats the official statement anyway, but these demilitarized metal boxes still remain active as civilian ships.

The Hexegonal Screen has a stable ship system, apprently as a result of a system loop hole that cause the ship system to react extremely to various problems. After various adjustment, this allows the Hexegonal Screen to keep its resource consumption at a minimal in combat, letting it operate for longer. Even though its armament makes extended combat operation a very undesirable proposition for most. 
",,,,
SGB_Jolt,SHIP,"A ship known to be small and vicious, though once you learn its actual classification you will realize its size is far from standard for its size. The greatest feature of the Jolt is its extra internal deck. These backup force can be quickly deployed, and the hidden slot under the large hardpoint can also be a powerful surprise.

As one of the most common ships of the 27th battlegroup, the Jolt was initially bidded as a cruiser design, but lost given its lack of firepower density. In the end, its designer inexplicably downgraded the ship's spec for the ship - revamping its operating system with a destroyer's spec, and finally won an order through this absurd method. Worth noting that both the Jolt and Carving class are  designed by the same firm.

Lost to the Ascaedy in its original cruiser bid. ",,,,
SGB_Jolt_2,SHIP,"This Jolt is an extremely rare original prototype, adjusted only to the extent required to use modern weapons. Compared to most current models, this ship has a stronger flux system with a more stable thruster. A ship known to be small and vicious, though once you learn its actual classification you will realize its size is far from standard for its size. The greatest feature of the Jolt is its extra internal deck. These backup force can be quickly deployed, and the hidden slot under the large hardpoint can also be a powerful surprise.

As one of the most common ships of the 27th battlegroup, the Jolt was initially bidded as a cruiser design, but lost given its lack of firepower density. In the end, its designer inexplicably downgraded the ship's spec for the ship - revamping its operating system with a destroyer's spec, and finally won an order through this absurd method. Worth noting that both the Jolt and Carving class are  designed by the same firm.

Lost to the Ascaedy in its original cruiser bid. ",,,,
SGB_Bastard,SHIP,"A fast fighter with a robust flux grid, many of its design specs are borrowed from the infamous gladius - but greatly improved the flux system to keep the fighter's weapon in operation.

It is made to completely take over Gladius' market share. ",,,,
# Old ---,,,,,,
SGB_Ogent,SHIP,"Ogent-Class's most distinctive feature is its unique built-in missile. This high-strength armor-piercing steel needle will pose a threat to the enemy no matter what - hitting the shield or directly damaging the structure. The ship itself has good cruising speed, and it always has a good effect when pursuing and killing enemy ships. In most cases, it will work with wolves to quickly tear apart enemy's large ships.",,,,
SGB_Davington,SHIP,"The Davington-Class possesses fierce missile projection capabilities. An experienced captain will drive this ship to fiercely pursue and annihilate enemy ships, but will choose the right timing, as the Davington-Class does not have an excellent point defense system. Its built-in Typhoon-Class Reaper Torpedo is a major weapon for securing victory.",,,,
SGB_Whip,SHIP,"The Whip Class have unique built in missile launcher that makes it apt in providing support in the mid to backline in a battle - or carry a sufficiently large payload of finisher and strike torpedo and wade into the fray, where they advance through the enemy wrecks torn apart by Reaper torpedos; In most situation, the Whip class can handle large amount of enemy missile and fighter squadrons, creating the ideal situation for other ships to carry out their attacks. 
",,,,
SGB_Aligate,SHIP,"The Aligate-Class and the Alicuty-Class are very similar, but different from the latter. This ship leans more towards an aircraft carrier role, with its deck and maintenance facilities easily supporting the needs of two squadrons of fighter jets.",,,,
SGB_Alicuty,SHIP,"The Alicuty-Class and the Aligate-Class are very similar, yet distinct from the latter. This ship is more inclined towards a destroyer position, with its compressed deck space only able to support the deployment of one squadron of fighter jets. However, the additional gun turrets and the freed-up internal space allow it to perform more diversely in battle.",,,,
SGB_Achilles,SHIP,"Thanks to its built in loading mechanism, the Achilles class can steadily unleash its might over enemy ships whether you use it like a hammer or a crossbow. The built in Lupus missiles can also turn the tide in a pinch; While not aesthetically pleasing, aggressive captains often requests to pilot this ship to hammer the enemy the face. 
",,,,
SGB_Snapdragon,SHIP,"The front half of the Firetong was once a flight deck, now modified into more turret space - this act further restricted interior space of the ship, making it harder to receive personal modification throguh the installation of hullmods. In theory, this ship have vicious firepower that can match a Eagle Class, and a ludicrous amount of mixed slots can support various absurd loadout designed by various captains to cause the most hassle for its enemies.

The Firetong was not a original design by the Shackles Garrison, but rather a common escort ship within the Persean League escort fleet during Shackle's retreat from the core sector -  many of these ship sent to support the Shackles Garrison was eventually gifted it to carry out basic escort mission to the declining Shackles Garrison. As a result, this ship who played such an important role during a historical time made a lasting impression on the Shackles Garrision. With many support, the design was purchased, modified, and eventually reverse-engineered - a fact that the Persean League had not taken issue with. After that, the Firetong class begin to make a name for itself in the Shackles Fleet, and had caused more than one bounty hunter to curse their latest job from Tri-Tachyon or Hegemony. 

However, modification to this ship's design have also caused many maintenance crew to curse the fire control rooms that were once flight decks - after all, to limit the impact on the ship's design, many internal structure meant for a carrier to service fighters were preserved, but intermingled with cabling and sensors of the fire control system. This has truly pissed off almost all logistic personal who had been allocated to service the Firetong Class, who jokingly refer to themselves as Tong Soot - worthless, all over the place, ultimately soot black and replacable. ",,,,
SGB_Falcon,SHIP,"It is evident that this design is based on a Falcon-Class light cruiser. This Falcon-Class received a system reconstruction and modification from Shackles Garrison, which somewhat compromised the ship's theoretical top speed and energy limit. However, thanks to the specialized engines from Shackles Garrison, the ship's full-speed maneuverability before an engagement slightly outperforms the older models. Yet, once engaged with the enemy, it struggles to disengage quickly.",,,,
SGB_Falcon_2,SHIP,"It is evident that this design is based on a Falcon-Class light cruiser. This particular Falcon-Class underwent system reconstruction and modification from Shackles Garrison in its early stages. Subsequent restorative construction also brought back the ship's fundamental performance metrics. Additionally, it was equipped with defensive missiles - Whip. Thanks to the specialized engines from Shackles Garrison, the ship's full-speed maneuverability before an engagement significantly surpasses that of the older models from the 27th.",,,,
SGB_Eagle,SHIP,"It is evident that this design is based on a Eagle-Class cruiser. This Eagle-Class has undergone a system overhaul from Shackles Garrison, which to some extent diminishes the ship's theoretical top speed and energy capacity limits. However, thanks to the specialized engines from Shackles Garrison, the ship's full-speed maneuverability before engaging in battle slightly outperforms the older models. Yet, once it gets entangled with the enemy, it struggles to disengage quickly.",,,,
SGB_Eagle_2,SHIP,"It is evident that this design is based on a Eagle-Class cruiser. This Eagle-Class vessel underwent a systemic rebuild by Shackles Garrison in its early stages, and subsequent restorative constructions have restored the ship's fundamental performance metrics. The ship has also been equipped with additional small defensive missiles. Thanks to the specialized engines from Shackles Garrison, the ship's full-speed maneuverability in pre-combat situations is superior to the older models of the 27th.",,,,
SGB_Carving,SHIP,"Were it not fitted with cruiser-level hullmod ports, there is no way the Carving Class would be called a Cruiser. The ship's built-in PD array has staaggering recoil, but it also can make a large volume its facing into a no-fly zone with terrifying efficiency. Any cluster of small missile or poorly armored strike craft squadron will drown in an ocean of frags in an instant. 

After the ship has formally entered service, many captain realized that the system of the Carving class is not that complicated - at least not as hard to modified as those of the capital ships. Accordingly, modifying the ship's safety system became a hobby of many radical crews. This lead to the admiralty issuing a correspondingly strict laws - given the effect these practice has on ship life, not to mention it clearly exposed the actual capability of the ship, something the Shackles Garrison wishes to conceal. ",,,,
SGB_Carving_SD,SHIP,"This Carving's paintjob and circumstance of its apperance makes it clear as to its ownership - or is that so? After some data searching, it is easy to discover this ship has been spared the attention of a certain leader, in fact, many of its system has the same operating backdoor as regular versions of the ship.

Not to mention that compared to existing modification of Sindarian Diktat, this is almost a 'wise modification' - This alone makes it clear it must not be the product of Sindarian shipyards. Many rumor suggest that it is linked to some unknown cooperation between the Shackles Garrison and the Diktat.

Were it not fitted with cruiser-level hullmod ports, there is no way the Carving Class would be called a Cruiser. The ship's built-in PD array has staaggering recoil, but it also can make a large volume its facing into a no-fly zone with terrifying efficiency. Any cluster of small missile or poorly armored strike craft squadron will drown in an ocean of frags in an instant. 

After the ship has formally entered service, many captain realized that the system of the Carving class is not that complicated - at least not as hard to modified as those of the capital ships. Accordingly, modifying the ship's safety system became a hobby of many radical crews. This lead to the admiralty issuing a correspondingly strict laws - given the effect these practice has on ship life, not to mention it clearly exposed the actual capability of the ship, something the Shackles Garrison wishes to conceal. ",,,,
SGB_Ascaedy,SHIP,"The Ascaedy-Class boasts a concentrated and dense weapon configuration, while also sparing space for strikecrafts. The built-in gun turret spiral system endows it with exceptionally superior reaction capabilities. As a type of aviation cruiser, the role of the Ascaedy-Class on the battlefield is straightforward - charge to the front line, then attempt to tear open a gap in the enemy's formation with its intense firepower.",,,,
#SGB_Anvil,SHIP,铸砧-级具备优异的导弹投射能力，其火力配置极为凶残 - 搭载了大量高速装填导弹系统，并具备相当罕见的淬火部署系统；设计上，铸砧-级往往应该位于前线附近提供支援，但几乎所有舰长都更乐意冲上去使用其搭载的凶残炮火快速解决问题。得益于其具备的大量高速装填导弹模块，铸砧-级即使在面对小船集群时也有着相当快速且主动的应对能力。,,,,
SGB_Anvil,SHIP,"The Anvil-Class, serving as a military logistics transport ship, possesses an unimaginably superior missile deployment capability. It has the rare Quench deployment system together with lots of high speed missile nest. In design, the Anvil-Class often acts as a slow fire support point, temporarily unloading cargo when necessary, and relying on its own armor to forcefully charge into enemy lines with the assistance of other ships. Thanks to its large number of high-speed reload missile modules, small escort wolf packs find it difficult to inflict decisive damage on the Anvil-Class without paying a price.
",,,,
SGB_Stress,SHIP,"Stress-Class further extends the glory of the Eagle family, with its good mobility and diverse assembly methods allowing it to take on many roles on the battlefield - although in most cases it assumes the position of long-range suppression, and immediately changes position in emergencies; Under the tactical doctrine of the 27th, it can break into the center of the battlefield alongside cruiser-Class ships in an encounter, and then establish a solid bridgehead.

The design of the Stress-Class was completed while Shackles Garrison was en route to Perseus, with initial verification and mass production taking place at the capital Aouintes. The existing blueprints were lost following the Hegemony's strike operation against the capital. This ship represents an original model that still possesses its initial theoretical combat capabilities. Often, the Stress-Class is considered robust enough to serve as an upper-tier successor to the Eagle-Class, despite the consequent increase in maintenance costs, which are, however, entirely within acceptable limits compared to other battleships. While the slot allocations of this ship might seem modest, the Stress-Class's decent base amplitude, coupled with its mobility, ensures stable firepower for these slots and pursuit effectiveness under special circumstances.

Its biggest issue, and a frequent complaint from logistics personnel, pertains to the demand for armor maintenance - primarily painting and regular upkeep of protective layers. This necessity arises from its wing engines, fully integrated within the armor on both sides, and the constant heat they generate, almost clinging to the ship's armor layer. Consequently, it has earned the dubious distinction of being nicknamed ""Self-Peeling Armor - Class"" among maintenance crews across the galaxy.

Although it is a Battleship form Shackles Garrison, it is quite novel that there are no build-in missiles.
",,,,
SGB_Stress_2,SHIP,"This Stress-Class is a very rare original variant, modified only to accomodate modern weapons. Compared to most existing Stress Class, this ship have improved performance across the board; excellent mobility and a wide array of counter measures allows it to fulfil many roles in combat - be it support, suppression or destruction. Under the tactical doctrine of the 27th, it can break into the center of the battlefield alongside cruiser-Class ships in an encounter, and then establish a solid bridgehead.

The design of the Stress-Class was completed while Shackles Garrison was en route to Perseus, with initial verification and mass production taking place at the capital Aouintes. The existing blueprints were lost following the Hegemony's strike operation against the capital. This ship represents an original model that still possesses its initial theoretical combat capabilities. Often, the Stress-Class is considered robust enough to serve as an upper-tier successor to the Eagle-Class, despite the consequent increase in maintenance costs, which are, however, entirely within acceptable limits compared to other battleships. While the slot allocations of this ship might seem modest, the Stress-Class's decent base amplitude, coupled with its mobility, ensures stable firepower for these slots and pursuit effectiveness under special circumstances.

Its biggest issue, and a frequent complaint from logistics personnel, pertains to the demand for armor maintenance - primarily painting and regular upkeep of protective layers. This necessity arises from its wing engines, fully integrated within the armor on both sides, and the constant heat they generate, almost clinging to the ship's armor layer. Consequently, it has earned the dubious distinction of being nicknamed ""Self-Peeling Armor - Class"" among maintenance crews across the galaxy.
",,,,
SGB_Ductility,SHIP,"The stock of Ductility-Class ships is quite scarce, with all blueprints in Perseus lost. All existing Ductility-Class vessels are merely relics from ancient times. These unique hubs possess terrifying fighter projection capabilities; their highly complex black box systems can replicate a large number of shipborne aircraft after filling the amplitude energy conduits - and automatically automate these LPCs - projecting them across the entire battlefield.

The existing Ductility-Class has undergone extensive modernization, yet it remains an irreproducible ancient stock.",,,,
SGB_Ductility_2,SHIP,"This Ductility-Class ship is a rare early original model, having only undergone the necessary adjustments to accommodate modern weaponry. Compared to most existing Ductility-Class vessels, this ship boasts superior maneuverability and additional deck areas, enabling it to deploy more swarms of drones to overwhelm all enemies.

The stock of Ductility-Class ships is quite scarce, with all blueprints in Perseus lost. All existing Ductility-Class vessels are merely relics from ancient times. These unique hubs possess terrifying fighter projection capabilities; their highly complex black box systems can replicate a large number of shipborne aircraft after filling the amplitude energy conduits - and automatically automate these LPCs - projecting them across the entire battlefield.

The existing Ductility-Class has undergone extensive modernization, yet it remains an irreproducible ancient stock.",,,,
SGB_Onslaught,SHIP,"A design of historical renown. Thanks to the Onslaught-Class's simple maintenance system, mass production and deployment remained feasible; as Shackles Garrison focused more on the construction of Onslaught doctrines, this variant of the Onslaught-Class sacrificed a lot of armor and internal resistance structures in favor of mobility and numerous missile strike modules. However, thanks to its modified superior engines, the Onslaught-Class could always arrive at the front lines in time, breaking through enemy lines with a barrage and missiles that outnumbered the enemy's by several times.

When the Onslaught-Class was first launched from the orbital shipyard, this colossus, dwarfing surrounding ships, caused the entire star domain to tremble. There were even rumors that they were created in a long-forgotten war to serve as the mainstay against alien species. Later, engineers from the Domain of Man improved its blueprints by not only adding shield systems and upgrading hyperdrive engines but also reducing the number of necessary crew members through automation and iterative engineering. Even with other more advanced capital ship blueprints available, the Onslaught-Class remains one of the easiest capital ships to produce today due to its extremely simple system.

This warship, which did not consider shields in its design, could rely solely on reliable armor to protect the crew to the greatest extent while enduring fierce firepower and organizing effective counterattacks, thus winning the affection of officers and crew members. Despite relying on a large amount of ammunition supply for logistics, its unparalleled frontal firepower allows the Onslaught-Class to destroy entire fleets within minutes.",,,,
SGB_Forgnace_Battle,SHIP,"The Forge-Class, an exceptionally adept maneuvering battleship, was designed from the outset to form high-speed strike teams that could rapidly breach enemy defenses and achieve tactical objectives before the enemy could respond. Notably, its built-in Stibene-reaction shaped charge serves as a specialized missile for targeting large enemy vessels, capable of forcibly breaking through defensive lines led by enemy flagships in many situations. The most criticized aspect of the Forge-Class is that its extensive internal structures, exposed for dispersion purposes, make the seemingly thick armor difficult to utilize effectively.

The design of the Forge-Class dates back to before the collapse of the Stargate, when Shackles Garrison was still serving under the military system of Humanity's domain. Under urgent combat requirements, it developed a firepower ship exclusive to the 27th Army Group. At that time, the Forge-Class carried a large number of interstellar missiles that are now impossible to replicate. Due to the loss of manufacturing techniques, all current Forge-Class ships have adopted a new form of cruise missile - with equal power but limited quantity.",,,,
